Source,Url,Data Kind
CSSE at JHU (John Hopkins University),https://systems.jhu.edu/,COVID-19 cases for several countries
Brasil.IO,https://brasil.io/home/,COVID-19 cases per state and city in Brazil
World Bank Open Data,https://data.worldbank.org/,Population and GDP per capita for several countries
Our World In Data,https://ourworldindata.org/,Number of tests of COVID-19 for several countries
Universidade de São Paulo (USP) e Universidade Federal de São Paulo (Unifesp),https://exame.com/brasil/pesquisa-84-dos-casos-de-covid-19-na-cidade-de-sp-nao-foram-registrados/,"Estimate for SP, Brazil on 2020-07-29"
Universidade Federal de Pelotas (UFPel),https://www.saude.gov.br/noticias/agencia-saude/47155-concluida-a-maior-pesquisa-brasileira-sobre-a-covid-19,Estimate for Brazil on 2020-06-24
